journal	paper	author	url	size_in_kb	cum_size_in_kb
IJHS-49-2014-Issue-2	Nemicandra's Rules for Computing Multiplier and Divisor 	 Dipak Jadhav	https://insa.nic.in//writereaddata/UpLoadedFiles/IJHS/Vol49_3_4_DJadhav.pdf	86.0	748564.0
IJHS-49-2014-Issue-2	On Mathematical Complexity of Sriyantra 	 Vladislav-Veniamin Pustynski	https://insa.nic.in//writereaddata/UpLoadedFiles/IJHS/Vol49_3_5_Pustynski.pdf	790.0	749354.0
IJHS-49-2014-Issue-2	Versified Sine Tables in Jnanaraja's Siddhantasundara 	 Toke Knudsen	https://insa.nic.in//writereaddata/UpLoadedFiles/IJHS/Vol49_2_5_TKnudsen.pdf	547.0	749901.0
IJHS-49-2014-Issue-2	Trigonometric Tables in India 	 V Madhukar Mallayya	https://insa.nic.in//writereaddata/UpLoadedFiles/IJHS/Vol49_2_6_VMallayya.pdf	499.0	750400.0
IJHS-49-2014-Issue-2	Techno-Scientific Education and the Indian National Congress (1885-1918) 	 Nirmala Shah	https://insa.nic.in//writereaddata/UpLoadedFiles/IJHS/Vol49_3_6_NShah.pdf	63.0	750463.0
IJHS-49-2014-Issue-2	Historical Notes: Select Palm Leaf Manuscripts on Health Care 	 Deepak Bhattacharya	https://insa.nic.in//writereaddata/UpLoadedFiles/IJHS/Vol49_3_7_DBhatacharya.pdf	35.0	750498.0
IJHS-49-2014-Issue-2	Sankramavakyas of the Vakyakarana 	 K Mahesh	https://insa.nic.in//writereaddata/UpLoadedFiles/IJHS/Vol49_2_7_KMahesh.pdf	355.0	750853.0
IJHS-49-2014-Issue-2	The Karanakesari Tables for Computing Eclipse Phenomena 	 Clemency Montelle	https://insa.nic.in//writereaddata/UpLoadedFiles/IJHS/Vol49_2_8_CMontelle.pdf	2112.0	752965.0
IJHS-49-2014-Issue-2	Historical Notes: Some Nineteenth Century Indian Mathematicians Prior to Ramanujan 	 R Sridharan	https://insa.nic.in//writereaddata/UpLoadedFiles/IJHS/Vol49_3_8_RSridharan.pdf	153.0	753118.0
IJHS-49-2014-Issue-2	Historical Notes: Bankim Chandra-First Writer of Popular Science in Bengali 	 Sisir K Majumdar	https://insa.nic.in//writereaddata/UpLoadedFiles/IJHS/Vol49_3_9_SKMajumdar.pdf	41.0	753159.0
IJHS-49-2014-Issue-2	Makaranda Sarini and Allied Saurapakna Tables -A Study 	 K Rupa, Padmaja Venugopal and S Balachandra Rao	https://insa.nic.in//writereaddata/UpLoadedFiles/IJHS/Vol49_2_9_KRupa.pdf	1068.0	754227.0
IJHS-49-2014-Issue-2	Book Review: R N Iyengar - Parasaratantra: Ancient Sanskrit Text on Astronomy and Natural Sciences 	 	https://insa.nic.in//writereaddata/UpLoadedFiles/IJHS/Vol49_2_10_BookReview.pdf	76.0	754303.0
IJHS-49-2014-Issue-2	Historical Notes: Some Applications of First Approachable Sunya and Derivation of other Approachable Sunyas 	 K B Basant and Satyananda Panda	https://insa.nic.in//writereaddata/UpLoadedFiles/IJHS/Vol49_3_10_KBBasant.pdf	1840.0	756143.0
IJHS-49-2014-Issue-2	Book Review: Sita Sundar Ram-Bijapallava of Krsna Daivajna: Algebra in Sixteen Century India-A Critical Study 	 R C Gupta	https://insa.nic.in//writereaddata/UpLoadedFiles/IJHS/Vol49_3_11_RCGupta.pdf	51.0	756194.0
IJHS-49-2014-Issue-2	Project Report: The Traditional Ayurveda Practicing by Parambarya Vaidyas in Kerala and their Unique Ethical Outlook 	 Sreekumar Nellickappilly	https://insa.nic.in//writereaddata/UpLoadedFiles/IJHS/Vol49_3_12_SNellickappilly.pdf	44.0	756238.0
IJHS-49-2014-Issue-2	Project Reports: The Garo Perception of Disease and Medicine: A History Since the British Regime in the Indian Sub-Continent 	 Pratibha Mandal	https://insa.nic.in//writereaddata/UpLoadedFiles/IJHS/Vol49_3_13_PMandal.pdf	50.0	756288.0
IJHS-49-2014-Issue-2	NEWS 	 	https://insa.nic.in//writereaddata/UpLoadedFiles/IJHS/Vol49_3_14_NEWS.pdf	15.0	756303.0
IJHS-49-2014-Issue-3	Contents 	 	https://insa.nic.in//writereaddata/UpLoadedFiles/IJHS/Vol49_3_0_Contents.pdf	22.0	756325.0
IJHS-49-2014-Issue-3	Parasara's Six Season Solar Zodiac and Heliacal Visibility of Star Agastya in 1350-1130 BC 	 R N Iyengar	https://insa.nic.in//writereaddata/UpLoadedFiles/IJHS/Vol49_3_1_RN_Iyengar.pdf	641.0	756966.0
IJHS-49-2014-Issue-3	Plant Diseases and their Treatment in Sanskrit Literature 	 Dhananjay Vasudeo Dwivedi	https://insa.nic.in//writereaddata/UpLoadedFiles/IJHS/Vol49_3_2_Dwivedi.pdf	79.0	757045.0
IJHS-49-2014-Issue-3	Methods of Interpolation in Indian Astronomy 	 Nidhi Handa and Padmavati Taneja	https://insa.nic.in//writereaddata/UpLoadedFiles/IJHS/Vol49_3_3_NHanda.pdf	444.0	757489.0
IJHS-49-2014-Issue-3	Nemicandra's Rules for Computing Multiplier and Divisor 	 Dipak Jadhav	https://insa.nic.in//writereaddata/UpLoadedFiles/IJHS/Vol49_3_4_DJadhav.pdf	86.0	757575.0
IJHS-49-2014-Issue-3	On Mathematical Complexity of Sriyantra 	 Vladislav-Veniamin Pustynski	https://insa.nic.in//writereaddata/UpLoadedFiles/IJHS/Vol49_3_5_Pustynski.pdf	790.0	758365.0
IJHS-49-2014-Issue-3	Techno-Scientific Education and the Indian National Congress (1885-1918) 	 Nirmala Shah	https://insa.nic.in//writereaddata/UpLoadedFiles/IJHS/Vol49_3_6_NShah.pdf	63.0	758428.0
IJHS-49-2014-Issue-3	Historical Notes: Select Palm Leaf Manuscripts on Health Care 	 Deepak Bhattacharya	https://insa.nic.in//writereaddata/UpLoadedFiles/IJHS/Vol49_3_7_DBhatacharya.pdf	35.0	758463.0
IJHS-49-2014-Issue-3	Historical Notes: Some Nineteenth Century Indian Mathematicians Prior to Ramanujan 	 R Sridharan	https://insa.nic.in//writereaddata/UpLoadedFiles/IJHS/Vol49_3_8_RSridharan.pdf	153.0	758616.0
IJHS-49-2014-Issue-3	Historical Notes: Bankim Chandra-First Writer of Popular Science in Bengali 	 Sisir K Majumdar	https://insa.nic.in//writereaddata/UpLoadedFiles/IJHS/Vol49_3_9_SKMajumdar.pdf	41.0	758657.0
IJHS-49-2014-Issue-3	Historical Notes: Some Applications of First Approachable Sunya and Derivation of other Approachable Sunyas 	 K B Basant and Satyananda Panda	https://insa.nic.in//writereaddata/UpLoadedFiles/IJHS/Vol49_3_10_KBBasant.pdf	1840.0	760497.0
IJHS-49-2014-Issue-3	Book Review: Sita Sundar Ram-Bijapallava of Krsna Daivajna: Algebra in Sixteen Century India-A Critical Study 	 R C Gupta	https://insa.nic.in//writereaddata/UpLoadedFiles/IJHS/Vol49_3_11_RCGupta.pdf	51.0	760548.0
IJHS-49-2014-Issue-3	Project Report: The Traditional Ayurveda Practicing by Parambarya Vaidyas in Kerala and their Unique Ethical Outlook 	 Sreekumar Nellickappilly	https://insa.nic.in//writereaddata/UpLoadedFiles/IJHS/Vol49_3_12_SNellickappilly.pdf	44.0	760592.0
IJHS-49-2014-Issue-3	Project Reports: The Garo Perception of Disease and Medicine: A History Since the British Regime in the Indian Sub-Continent 	 Pratibha Mandal	https://insa.nic.in//writereaddata/UpLoadedFiles/IJHS/Vol49_3_13_PMandal.pdf	50.0	760642.0
IJHS-49-2014-Issue-3	NEWS 	 	https://insa.nic.in//writereaddata/UpLoadedFiles/IJHS/Vol49_3_14_NEWS.pdf	15.0	760657.0
IJHS-49-2014-issue-4	Contents 	 	https://insa.nic.in//writereaddata/UpLoadedFiles/IJHS/Vol49_4_0_Contents.pdf	15.0	760672.0
IJHS-49-2014-issue-4	Editorial 	 	https://insa.nic.in//writereaddata/UpLoadedFiles/IJHS/Vol49_4_1_Editorial.pdf	87.0	760759.0
IJHS-49-2014-issue-4	Guest Editorial 	 	https://insa.nic.in//writereaddata/UpLoadedFiles/IJHS/Vol49_4_2_Guest_Editorial.pdf	78.0	760837.0
IJHS-49-2014-issue-4	The Chemical Researches of Acharya Prafulla Chandra Ray 	 Animesh Chakravorty	https://insa.nic.in//writereaddata/UpLoadedFiles/IJHS/Vol49_4_3_AChakravorty.pdf	254.0	761091.0
IJHS-49-2014-issue-4	Early Research in Physical Chemistry in India 	 Kankan Bhattacharyya	https://insa.nic.in//writereaddata/UpLoadedFiles/IJHS/Vol49_4_4_KBhattacharyya.pdf	52.0	761143.0
IJHS-49-2014-issue-4	History of Natural Products Chemistry in India 	 K Nagarajan	https://insa.nic.in//writereaddata/UpLoadedFiles/IJHS/Vol49_4_5_KNagarajan.pdf	596.0	761739.0
IJHS-49-2014-issue-4	Indian Organic Chemical Industry: Decades of Struggle & Achievements 	 K Nagarajan	https://insa.nic.in//writereaddata/UpLoadedFiles/IJHS/Vol49_4_6_AVRRao.pdf	576.0	762315.0
IJHS-49-2014-issue-4	Medicinal Chemistry Research in India 	 Harikishan Singh	https://insa.nic.in//writereaddata/UpLoadedFiles/IJHS/Vol49_4_7_HSingh.pdf	415.0	762730.0
IJHS-49-2014-issue-4	A Short History of Electrochemistry in India 	 A K Shukla and T Prem Kumar	https://insa.nic.in//writereaddata/UpLoadedFiles/IJHS/Vol49_4_8_AKShukla.pdf	25.0	762755.0
IJHS-49-2014-issue-4	Historical Notes: Manuscripts on Alchemy in India - Commentaries and Editions 	 Mira Roy	https://insa.nic.in//writereaddata/UpLoadedFiles/IJHS/Vol49_4_9_MRoy.pdf	39.0	762794.0
IJHS-49-2014-issue-4	Chemical Research in British India (1788-1900) 	 B K Sen	https://insa.nic.in//writereaddata/UpLoadedFiles/IJHS/Vol49_4_10_BKSen.pdf	50.0	762844.0
IJHS-49-2014-issue-4	The Making of a Classic: The Contemporary Significance of P. C. Ray's Historical Approach 	 Dhruv Raina	https://insa.nic.in//writereaddata/UpLoadedFiles/IJHS/Vol49_4_11_DRaina.pdf	61.0	762905.0
IJHS-49-2014-issue-4	Good Life, Self-Sufficiency and Chemical Knowledge: Through The Chemical Worls View of Late Jnan Chandra Ghosh 	 Prajit K Basu	https://insa.nic.in//writereaddata/UpLoadedFiles/IJHS/Vol49_4_12_PKBasu.pdf	53.0	762958.0
IJHS-49-2014-issue-4	Book Reviews 	 	https://insa.nic.in//writereaddata/UpLoadedFiles/IJHS/Vol49_4_13_Bookreview.pdf	75.0	763033.0
IJHS-49-2014-issue-4	Books Received for Review 	 	https://insa.nic.in//writereaddata/UpLoadedFiles/IJHS/Vol49_4_14_Bookreceived.pdf	17.0	763050.0
IJHS-49-2014-issue-4	Cumulative Index 	 	https://insa.nic.in//writereaddata/UpLoadedFiles/IJHS/Vol49_4_15_CumulativeIndex.pdf	40.0	763090.0
IJHS-49-2014-issue-4	Annual Contents 2014 	 	https://insa.nic.in//writereaddata/UpLoadedFiles/IJHS/Vol49_4_16_AnnualContents2014.pdf	28.0	763118.0
IJHS-50-2015-Issue-1	Contents 	 	https://insa.nic.in//writereaddata/UpLoadedFiles/IJHS/Vol50_2015_1_Contents.pdf	105.0	763223.0
IJHS-50-2015-Issue-1	Massage  From: President INSA 	 Raghavendra Gadagkar	https://insa.nic.in//writereaddata/UpLoadedFiles/IJHS/Vol50_2015_1_Message_President.pdf	79.0	763302.0
IJHS-50-2015-Issue-1	Editorial 	 D Balasubramanian, A K Bag	https://insa.nic.in//writereaddata/UpLoadedFiles/IJHS/Vol50_2015_1_Art01.pdf	28.0	763330.0
IJHS-50-2015-Issue-1	Early System of Naksatras, Calendar and Antiquity of the Vedic & Harappan Traditions 	 A K Bag	https://insa.nic.in//writereaddata/UpLoadedFiles/IJHS/Vol50_2015_1_Art02.pdf	286.0	763616.0
IJHS-50-2015-Issue-1	Soma, an Enigmatic, Mysterious Plant of the Vedic Aryas: An Appraisal 	 N C Shah	https://insa.nic.in//writereaddata/UpLoadedFiles/IJHS/Vol50_2015_1_Art03.pdf	368.0	763984.0
IJHS-50-2015-Issue-1	Crafts and Technologies of the Chalcolithic People of South Asia: An Overview 	 Vasant Shinde	https://insa.nic.in//writereaddata/UpLoadedFiles/IJHS/Vol50_2015_1_Art04.pdf	52.0	764036.0
IJHS-50-2015-Issue-1	The Metal Casting Traditions of South Asia: Continuity and Innovation 	 Paul T Craddock	https://insa.nic.in//writereaddata/UpLoadedFiles/IJHS/Vol50_2015_1_Art05.pdf	900.0	764936.0
IJHS-50-2015-Issue-1	Foundations of Immunology in Ayurvedic classics 	 Ram H Singh	https://insa.nic.in//writereaddata/UpLoadedFiles/IJHS/Vol50_2015_1_Art06.pdf	104.0	765040.0
IJHS-50-2015-Issue-1	From Persons to Hospital Cases: The Rise of Hospital Medicine and the Calcutta Medical College in India 	 Jayanta Bhattacharyra	https://insa.nic.in//writereaddata/UpLoadedFiles/IJHS/Vol50_2015_1_Art07.pdf	899.0	765939.0
IJHS-50-2015-Issue-1	Historical Note: Concept of Manas in Samkhya Darsana 	 Hetal Amin	https://insa.nic.in//writereaddata/UpLoadedFiles/IJHS/Vol50_2015_1_Art08.pdf	65.0	766004.0
IJHS-50-2015-Issue-1	Historical Note: Percetion of Food and Nutrition and Dietary Recommendation in Health and Disease: Focus on Caraka-Susruta Samhitas 	 Sukta Das	https://insa.nic.in//writereaddata/UpLoadedFiles/IJHS/Vol50_2015_1_Art09.pdf	103.0	766107.0
IJHS-50-2015-Issue-1	Historical Note: Old Water-Works on the Eastern Part of Mysore Plateau 	 Jean Deloche	https://insa.nic.in//writereaddata/UpLoadedFiles/IJHS/Vol50_2015_1_Art10.pdf	391.0	766498.0
IJHS-50-2015-Issue-1	Book Review: A Selected Works of Gurugovinda Chakravarti on Ancient and Medieval Indian Mathematics 	 AKBag	https://insa.nic.in//writereaddata/UpLoadedFiles/IJHS/Vol50_2015_1_Art11.pdf	28.0	766526.0
IJHS-50-2015-Issue-1	Book Review: History of Science in India, Vol. III: Chemical Science 	 D Banerjea	https://insa.nic.in//writereaddata/UpLoadedFiles/IJHS/Vol50_2015_1_Art12.pdf	37.0	766563.0
IJHS-50-2015-Issue-1	Project Report: Use of Solar Passice Concepts in the Avadh Architechtectural Buildings and their Modified Impact 	 Usha Bajpai	https://insa.nic.in//writereaddata/UpLoadedFiles/IJHS/Vol50_2015_1_Art13.pdf	551.0	767114.0
IJHS-50-2015-Issue-1	News: Magic Square for 2015 	 S R Sharma	https://insa.nic.in//writereaddata/UpLoadedFiles/IJHS/Vol50_2015_1_Art14.pdf	695.0	767809.0
IJHS-50-2015-Issue-1	News: 900th Birth Anniversary of Bhaskaracarya: A Brief Report 	 Madhavendra Narayan	https://insa.nic.in//writereaddata/UpLoadedFiles/IJHS/Vol50_2015_1_Art15.pdf	118.0	767927.0
IJHS-50-2015-Issue-2	Contents 	 	https://insa.nic.in//writereaddata/UpLoadedFiles/IJHS/Vol50_2015_2_Contents.pdf	103.0	768030.0
IJHS-50-2015-Issue-2	Descriptions and Classification of Cancer in the Classical Ayurvedic Texts 	 P  Ram Manohar	https://insa.nic.in//writereaddata/UpLoadedFiles/IJHS/Vol50_2015_2_Art01.pdf	347.0	768377.0
IJHS-50-2015-Issue-2	Some Medicinal Plants of Indian Puranas in Today’s Ethnomedicinal Perspective 	 Madhumita Nath 	https://insa.nic.in//writereaddata/UpLoadedFiles/IJHS/Vol50_2015_2_Art02.pdf	189.0	768566.0
IJHS-50-2015-Issue-2	Classification of Substances in Vaidyanighantus -Medical Lexions 	 B Rama Rao	https://insa.nic.in//writereaddata/UpLoadedFiles/IJHS/Vol50_2015_2_Art03.pdf	173.0	768739.0
IJHS-50-2015-Issue-2	Allusions to Ancient Indian Mathematical Sciences in an Early Eighth Century Chinese Compilation by  	 Vijaya J Deshpande	https://insa.nic.in//writereaddata/UpLoadedFiles/IJHS/Vol50_2015_2_Art04.pdf	1431.0	770170.0
IJHS-50-2015-Issue-2	Narayana’s Generalisation of Matra-Vrtta-Prastara and the Generalised Virahanka-Fibonacci Representa 	 Raja Sridharan	https://insa.nic.in//writereaddata/UpLoadedFiles/IJHS/Vol50_2015_2_Art05.pdf	1800.0	771970.0
IJHS-50-2015-Issue-2	Rationale for Vakyas Pertaining to the Sun in Karanapaddhati 	 Venketeswara Pai R	https://insa.nic.in//writereaddata/UpLoadedFiles/IJHS/Vol50_2015_2_Art06.pdf	833.0	772803.0
IJHS-50-2015-Issue-2	Lalah Bulhomal Lahori and the Production of Traditional Astronomical Instruments at Lahore in the Ni 	 S R Sarma	https://insa.nic.in//writereaddata/UpLoadedFiles/IJHS/Vol50_2015_2_Art07.pdf	1283.0	774086.0
IJHS-50-2015-Issue-2	Historical Note: Ambergris in Perfumery in the Past and Present Indian Context and the Western World 	 T M Srinivasan	https://insa.nic.in//writereaddata/UpLoadedFiles/IJHS/Vol50_2015_2_Art08.pdf	813.0	774899.0
IJHS-50-2015-Issue-2	Historical Note: Traditional Healing Practices in North East India 	 Ramashankar	https://insa.nic.in//writereaddata/UpLoadedFiles/IJHS/Vol50_2015_2_Art09.pdf	374.0	775273.0
IJHS-50-2015-Issue-2	Historical Note: Historical Antecedents of Cancer Surveillance from 1805 to 1891 	 Wilson I B Onuigbo	https://insa.nic.in//writereaddata/UpLoadedFiles/IJHS/Vol50_2015_2_Art10.pdf	119.0	775392.0
IJHS-50-2015-Issue-2	Historical Note: Scientific Exploration of the Snow Fungus (Tremella fuciformis Berk.) 	 Ruixia Wang	https://insa.nic.in//writereaddata/UpLoadedFiles/IJHS/Vol50_2015_2_Art11.pdf	369.0	775761.0
IJHS-50-2015-Issue-2	Project Report: Metrological Traditions of South India 	 V Selvakumar	https://insa.nic.in//writereaddata/UpLoadedFiles/IJHS/Vol50_2015_2_Art12.pdf	920.0	776681.0
IJHS-50-2015-Issue-2	Book Review: Indian Astronomy -Concepts and Procedures by S Balachandra Rao  	 A K Bhatnagar	https://insa.nic.in//writereaddata/UpLoadedFiles/IJHS/Vol50_2015_2_Art13.pdf	105.0	776786.0
IJHS-50-2015-Issue-2	News: Cross Civilizational Interactions in Antiquity: India, Iran, Greece and China - A Report 	 Surajit Sarkar	https://insa.nic.in//writereaddata/UpLoadedFiles/IJHS/Vol50_2015_2_Art14.pdf	108.0	776894.0
IJHS-50-2015-Issue-2	News: Sir JC Bose Trust: An Appeal 	 Trustee, Sir JC Bose Trust	https://insa.nic.in//writereaddata/UpLoadedFiles/IJHS/Vol50_2015_2_Art15.pdf	99.0	776993.0
IJHS-50-2015-Issue-3	Contents 	 	https://insa.nic.in//writereaddata/UpLoadedFiles/IJHS/Vol50_2015_3_CONTENTS.pdf	13.0	777006.0
IJHS-50-2015-Issue-3	Ideas and Researches on Physical Concepts in India 	 AK Bag	https://insa.nic.in//writereaddata/UpLoadedFiles/IJHS/Vol50_2015_3_Art01.pdf	568.0	777574.0
IJHS-50-2015-Issue-3	Kanny Lall Dey– Pioneer Proponent of Indigenous Drugs 	 Harkishan Singh	https://insa.nic.in//writereaddata/UpLoadedFiles/IJHS/Vol50_2015_3_Art02.pdf	113.0	777687.0
IJHS-50-2015-Issue-3	Sir Asutosh and Rise of Modern Science in India 	 Kankan Bhattacharyya	https://insa.nic.in//writereaddata/UpLoadedFiles/IJHS/Vol50_2015_3_Art03.pdf	86.0	777773.0
IJHS-50-2015-Issue-3	The Doctoral Research of Acharya Prafulla Chandra Ray 	 Animesh Chakravorty	https://insa.nic.in//writereaddata/UpLoadedFiles/IJHS/Vol50_2015_3_Art04.pdf	155.0	777928.0
IJHS-50-2015-Issue-3	D M Bose and Cosmic Ray Research 	 S C Roy	https://insa.nic.in//writereaddata/UpLoadedFiles/IJHS/Vol50_2015_3_Art05.pdf	1618.0	779546.0
IJHS-50-2015-Issue-3	An Account of the Development of Nuclear Magnetic Resonance (NMR) in India 	 Girjesh Govil	https://insa.nic.in//writereaddata/UpLoadedFiles/IJHS/Vol50_2015_3_Art06.pdf	192.0	779738.0
IJHS-50-2015-Issue-3	Historical Notes: Electrochemistry and Fuel Cells: The Contribution of William Robert Grove 	 Jaime Wisniak	https://insa.nic.in//writereaddata/UpLoadedFiles/IJHS/Vol50_2015_3_Art07.pdf	54.0	779792.0
IJHS-50-2015-Issue-3	Historical Notes: Historiography and Commentary on the Nepal - India Earthquake of 26 August 1833 	 Sujit Dasgupta	https://insa.nic.in//writereaddata/UpLoadedFiles/IJHS/Vol50_2015_3_Art08.pdf	844.0	780636.0
IJHS-50-2015-Issue-3	Historical Notes: Rabies, Anti-Rabic Vaccine and the Raj 	 Gagandip Cheema	https://insa.nic.in//writereaddata/UpLoadedFiles/IJHS/Vol50_2015_3_Art09.pdf	29.0	780665.0
IJHS-50-2015-Issue-3	Historical Notes: Features of Mathematical Sciences in India in the Second World War 	 Jagdish N Sinha	https://insa.nic.in//writereaddata/UpLoadedFiles/IJHS/Vol50_2015_3_Art10.pdf	58.0	780723.0
IJHS-50-2015-Issue-3	Historical Notes: Doctorate Degrees from India: 1877 (first award) to 1920 	 B K Sen	https://insa.nic.in//writereaddata/UpLoadedFiles/IJHS/Vol50_2015_3_Art11.pdf	11.0	780734.0
IJHS-50-2015-Issue-3	Project Report: English Translation with critical notes and indexing of Pathyapathyaviniscaya - A 16 	 P Ram Manohar	https://insa.nic.in//writereaddata/UpLoadedFiles/IJHS/Vol50_2015_3_Art12.pdf	145.0	780879.0
IJHS-50-2015-Issue-3	Book Review: Taming the Unknown - A History of Algebra from Antiquity to the Early Twentieth Century 	 Raja Sridhran	https://insa.nic.in//writereaddata/UpLoadedFiles/IJHS/Vol50_2015_3_Art13.pdf	26.0	780905.0
IJHS-50-2015-Issue-3	News 	 	https://insa.nic.in//writereaddata/UpLoadedFiles/IJHS/Vol50_2015_3_Art14.pdf	7.0	780912.0
IJHS-50-2015-Issue-4	Contents 	 Issue 4	https://insa.nic.in//writereaddata/UpLoadedFiles/IJHS/Vol50_2015_4_CONTENTS.pdf	113.0	781025.0
IJHS-50-2015-Issue-4	Sacrificially Important Trees Revealed in the Krsna Yajurveda Samhita- Their Description and Uses 	 Raghava S Boddupalli and Vedam Venkata Rama Sastri	https://insa.nic.in//writereaddata/UpLoadedFiles/IJHS/Vol50_2015_4_Art01.pdf	4585.0	785610.0
IJHS-50-2015-Issue-4	Identity and Attributes of Ayurvedic Medicinal Plant Brahmi/Aindri from Antiquity to the Modern Age 	 Ram H Singh	https://insa.nic.in//writereaddata/UpLoadedFiles/IJHS/Vol50_2015_4_Art02.pdf	177.0	785787.0
IJHS-50-2015-Issue-4	Survey of Zijes Written in the Subcontinent 	 S M Razaullah Ansari	https://insa.nic.in//writereaddata/UpLoadedFiles/IJHS/Vol50_2015_4_Art03.pdf	3540.0	789327.0
IJHS-50-2015-Issue-4	Nilakanthas Value of R-Sine for the Arc of Twenty-four Degrees 	 Takao Hayashi	https://insa.nic.in//writereaddata/UpLoadedFiles/IJHS/Vol50_2015_4_Art04.pdf	931.0	790258.0
IJHS-50-2015-Issue-4	HISTEM and the Making of Modern India — Some Questions and Explanations 	 Deepak Kumar	https://insa.nic.in//writereaddata/UpLoadedFiles/IJHS/Vol50_2015_4_Art05.pdf	156.0	790414.0
IJHS-50-2015-Issue-4	Historical Note: In Search of Roots: Tracing the History and Philosophy of Indian Medicine 	 Bhushan Patwardhan, Sharad Deshpande, Girish Tillu	https://insa.nic.in//writereaddata/UpLoadedFiles/IJHS/Vol50_2015_4_Art06.pdf	163.0	790577.0
IJHS-50-2015-Issue-4	Historical Note: Trigonometrical Survey of India and Naming of Peak XV as Mt. Everest 	 Shrikant Mishra et al.	https://insa.nic.in//writereaddata/UpLoadedFiles/IJHS/Vol50_2015_4_Art07.pdf	216.0	790793.0
IJHS-50-2015-Issue-4	Correspondence: Ideas and Researches on Physical Concepts in India 	 BV Subbarayappa	https://insa.nic.in//writereaddata/UpLoadedFiles/IJHS/Vol50_2015_4_Art08.pdf	112.0	790905.0
IJHS-50-2015-Issue-4	Book Review: Medicine, Trade and Empire: Garcia de Orta’s Colloquies on the Simples and Drugs of India (1563) in Context 	 S Sundara Rajan	https://insa.nic.in//writereaddata/UpLoadedFiles/IJHS/Vol50_2015_4_Art09.pdf	121.0	791026.0
IJHS-50-2015-Issue-4	Project Report: English Translation of Rasendra Cudamani 	 K Naveena	https://insa.nic.in//writereaddata/UpLoadedFiles/IJHS/Vol50_2015_4_Art10.pdf	151.0	791177.0
IJHS-50-2015-Issue-4	News: History of Science Seminar on the Indian Heritage: A Genomic View- A Report 	 Madhvendra Narayan	https://insa.nic.in//writereaddata/UpLoadedFiles/IJHS/Vol50_2015_4_Art11.pdf	103.0	791280.0
IJHS-50-2015-Issue-4	Books Received for Review and 	 Announcements	https://insa.nic.in//writereaddata/UpLoadedFiles/IJHS/Vol50_2015_4_Art12.pdf	112.0	791392.0
IJHS-50-2015-Issue-4	Cumulative Index 	 Year 2015	https://insa.nic.in//writereaddata/UpLoadedFiles/IJHS/Vol50_2015_4_Art13.pdf	143.0	791535.0
IJHS-50-2015-Issue-4	Annual Contents 	 Volume 50.1-4 (2015)	https://insa.nic.in//writereaddata/UpLoadedFiles/IJHS/Vol50_2015_4_Art14.pdf	118.0	791653.0
IJHS-51-2016-Issue-1	Contents 	 Contents	https://insa.nic.in//writereaddata/UpLoadedFiles/IJHS/Vol51_2016_1_Art01.pdf	149.0	791802.0
IJHS-51-2016-Issue-1	Editorial: Tradition & Methodology of Knowledge Production 	 A K Bag	https://insa.nic.in//writereaddata/UpLoadedFiles/IJHS/Vol51_2016_1_Art02.pdf	180.0	791982.0
IJHS-51-2016-Issue-1	Guest Editorial 	 Rajan Gurukkal	https://insa.nic.in//writereaddata/UpLoadedFiles/IJHS/Vol51_2016_1_Art03.pdf	115.0	792097.0
IJHS-51-2016-Issue-1	An Introductory Outline of Knowledge Production in Pre-colonial India 	 Rajan Gurukkal	https://insa.nic.in//writereaddata/UpLoadedFiles/IJHS/Vol51_2016_1_Art04.pdf	182.0	792279.0
IJHS-51-2016-Issue-1	Metallurgy of Zinc, High-tin Bronze and Gold in Indian Antiquity: Methodological Aspects 	 Sharada Srinivasan	https://insa.nic.in//writereaddata/UpLoadedFiles/IJHS/Vol51_2016_1_Art05.pdf	1338.0	793617.0
IJHS-51-2016-Issue-1	Carakas Approach to Knowledge 	 M S Valiathan	https://insa.nic.in//writereaddata/UpLoadedFiles/IJHS/Vol51_2016_1_Art06.pdf	259.0	793876.0
IJHS-51-2016-Issue-1	Origins and Growth of Ayurvedic Knowledge 	 M R Raghava Varier	https://insa.nic.in//writereaddata/UpLoadedFiles/IJHS/Vol51_2016_1_Art07.pdf	186.0	794062.0
IJHS-51-2016-Issue-1	Knowledge Generation in Ayurveda: Methodological Aspects 	 S N Venugopalan Nair and Darshan Shankar	https://insa.nic.in//writereaddata/UpLoadedFiles/IJHS/Vol51_2016_1_Art08.pdf	193.0	794255.0
IJHS-51-2016-Issue-1	What is Indian about Indian Mathematics? 	 P P Divakaran	https://insa.nic.in//writereaddata/UpLoadedFiles/IJHS/Vol51_2016_1_Art09.pdf	385.0	794640.0
IJHS-51-2016-Issue-1	Heliacal Rising of Canopus in Indian Astronomy 	 S Balachandra Rao, Rupa K and Padmaja Venugopal	https://insa.nic.in//writereaddata/UpLoadedFiles/IJHS/Vol51_2016_1_Art10.pdf	945.0	795585.0
IJHS-51-2016-Issue-1	Inference as a Means of Valid Knowledge in Indian Epistemological Tradition 	 C Rajendran	https://insa.nic.in//writereaddata/UpLoadedFiles/IJHS/Vol51_2016_1_Art11.pdf	144.0	795729.0
IJHS-51-2016-Issue-1	Debate as a Methodology of Knowledge Production in Pre-Modern India 	 A Raghuramaraju	https://insa.nic.in//writereaddata/UpLoadedFiles/IJHS/Vol51_2016_1_Art12.pdf	150.0	795879.0
IJHS-51-2016-Issue-1	Translation as Method: Implications for History of Science 	 Sundar Sarukkai	https://insa.nic.in//writereaddata/UpLoadedFiles/IJHS/Vol51_2016_1_Art13.pdf	174.0	796053.0
IJHS-51-2016-Issue-1	In Search of the Beginnings and Growth of Knowledge Production in Tamil 	 R Champakalakshmi	https://insa.nic.in//writereaddata/UpLoadedFiles/IJHS/Vol51_2016_1_Art14.pdf	182.0	796235.0
IJHS-51-2016-Issue-1	A Note on Grammatical Knowledge in Early Tamilakam 	 Y Subbarayalu	https://insa.nic.in//writereaddata/UpLoadedFiles/IJHS/Vol51_2016_1_Art15.pdf	155.0	796390.0
IJHS-51-2016-Issue-1	Body Centric Knowledge: Traditions of Performance and Pedagogy in Kathakali 	 Mundoli Narayanan	https://insa.nic.in//writereaddata/UpLoadedFiles/IJHS/Vol51_2016_1_Art16.pdf	192.0	796582.0
IJHS-51-2016-Issue-1	The Polysemy of the Prabandha – Reading a Premodern Musical Genre 	 Naresh Keerthi	https://insa.nic.in//writereaddata/UpLoadedFiles/IJHS/Vol51_2016_1_Art17.pdf	1565.0	798147.0
IJHS-51-2016-Issue-1	From the Mythology of Vastusastra to the Methodology of Vastuvidya 	 RV Achari	https://insa.nic.in//writereaddata/UpLoadedFiles/IJHS/Vol51_2016_1_Art18.pdf	778.0	798925.0
IJHS-51-2016-Issue-2A	Contents 	 	https://insa.nic.in//writereaddata/UpLoadedFiles/IJHS/Vol51_2016_2_1_Art00.pdf	103.0	799028.0
IJHS-51-2016-Issue-2A	Agricultural Practices as gleaned from the Tamil Literature of the Sangam Age 	 T M Srinivasan	https://insa.nic.in//writereaddata/UpLoadedFiles/IJHS/Vol51_2016_2_1_Art01.pdf	1207.0	800235.0
IJHS-51-2016-Issue-2A	Combinatorics as Found in the Gommatsara of Nemichandra 	 Dipak Jadhav and Anupam Jain	https://insa.nic.in//writereaddata/UpLoadedFiles/IJHS/Vol51_2016_2_1_Art02.pdf	921.0	801156.0
IJHS-51-2016-Issue-2A	Records of Vyatipata in Stone Inscriptions 	 B S Shylaja and Geetha Kydala	https://insa.nic.in//writereaddata/UpLoadedFiles/IJHS/Vol51_2016_2_1_Art03.pdf	1964.0	803120.0
