journal	paper	author	url	size_in_kb	cum_size_in_kb
IJHS-42-2007-Issue-2	Yantras or Mystic Diagrams: A Wide Area for Study in Ancient and Medieval Indian Mathematics 	 R C Gupta	https://insa.nic.in//writereaddata/UpLoadedFiles/IJHS/Vol42_2_4_RCGupta.pdf	552.0	643649.0
IJHS-42-2007-Issue-2	Zafarbaksh – The Composite Mughal Cannon of Aurangzeb at Fort William in Kolkata 	 R Balasubramaniam and Pranab K Chattopadhyay	https://insa.nic.in//writereaddata/UpLoadedFiles/IJHS/Vol42_2_5_RBalasubramaniam.pdf	576.0	644225.0
IJHS-42-2007-Issue-2	Historical Note: BG Tilak and Ancient Indian Astronomy – A Reappraisal 	 K D Abhyankar	https://insa.nic.in//writereaddata/UpLoadedFiles/IJHS/Vol42_2_6_KDAbhyankar.pdf	135.0	644360.0
IJHS-42-2007-Issue-2	Historical Note: BG Tilak and Ancient Indian Astronomy - A Reappraisal 	 K D Abhyankar	https://insa.nic.in//writereaddata/UpLoadedFiles/IJHS/Vol42_2_6_KDAbhyankar.pdf	135.0	644495.0
IJHS-42-2007-Issue-2	Historical Note: Epoch of Lalla – An Overview 	 K Chandra Hari	https://insa.nic.in//writereaddata/UpLoadedFiles/IJHS/Vol42_2_7_KCHari.pdf	103.0	644598.0
IJHS-42-2007-Issue-2	Historical Note: Cultivation of Naturally Coloured Cotton in India in the 19th century  	 Rekha Ranade	https://insa.nic.in//writereaddata/UpLoadedFiles/IJHS/Vol42_2_8_RRanade.pdf	58.0	644656.0
IJHS-42-2007-Issue-2	Historical Note: Reception of Relativity Theory in Different Social, Political and Religious Ideolog 	 Sisir Kumar Majumdar	https://insa.nic.in//writereaddata/UpLoadedFiles/IJHS/Vol42_2_9_SKMajumdar.pdf	142.0	644798.0
IJHS-42-2007-Issue-2	Book Review: The Legacy of Susruta 	 D Wujastyk	https://insa.nic.in//writereaddata/UpLoadedFiles/IJHS/Vol42_2_10_BookReviewDWajastyk.pdf	59.0	644857.0
IJHS-42-2007-Issue-2	Book Review: Galileo Galilei – When the World Stood Still 	 M S Sriram	https://insa.nic.in//writereaddata/UpLoadedFiles/IJHS/Vol42_2_11_BookReviewMSSriram.pdf	64.0	644921.0
IJHS-42-2007-Issue-2	Book Review: Chemical Sciences in Colonial India: The Science in Social History 	 Jagdish N Sinha	https://insa.nic.in//writereaddata/UpLoadedFiles/IJHS/Vol42_2_12_BookReviewJNSinha.pdf	28.0	644949.0
IJHS-42-2007-Issue-2	Obituary: Sushil Kumar Mukherjee (1914-2006)       	 Arun Kumar Biswas	https://insa.nic.in//writereaddata/UpLoadedFiles/IJHS/Vol42_2_13_Obituary.pdf	93.0	645042.0
IJHS-42-2007-Issue-2	News 	 	https://insa.nic.in//writereaddata/UpLoadedFiles/IJHS/Vol42_2_14_News.pdf	42.0	645084.0
IJHS-42-2007-Issue-2	Supplement: Karanakutuhalam of Bhaskaracarya II 	 S Balachandra Rao	https://insa.nic.in//writereaddata/UpLoadedFiles/IJHS/Vol42_2_15_Supplement.pdf	562.0	645646.0
IJHS-42-2007-Issue-3	Chinese Steel Making Techniques with a Note on Indian Wootz Steel in China 	 Donald B Wagner	https://insa.nic.in//writereaddata/UpLoadedFiles/IJHS/Vol42_3_1_DBWagner.pdf	521.0	646167.0
IJHS-42-2007-Issue-3	Production and Trade of Crucible Steel in Central Asia 	 Ann Feuerbach	https://insa.nic.in//writereaddata/UpLoadedFiles/IJHS/Vol42_3_2_AFeuerbach.pdf	272.0	646439.0
IJHS-42-2007-Issue-3	On the Question of Possible Transfer of Steel Technology from India to Europe through the Muslim Middle East 	 Jean Le Coze	https://insa.nic.in//writereaddata/UpLoadedFiles/IJHS/Vol42_3_3_JLCoze.pdf	398.0	646837.0
IJHS-42-2007-Issue-3	On the Origin of the terms Wootz‚ Hinduwani and Pulad 	 Ann Feuerbach‚ R Balasubramaniam and S Kalyanaraman	https://insa.nic.in//writereaddata/UpLoadedFiles/IJHS/Vol42_3_4_AFeuerbach.pdf	117.0	646954.0
IJHS-42-2007-Issue-3	From Wrought Iron to Steel: Beginning of Steel Making in Eastern India 	 Pranab K Chattopadhyay‚ Pradeep K Behera and Prasanta K Datta	https://insa.nic.in//writereaddata/UpLoadedFiles/IJHS/Vol42_3_5_PKChattopadhyay.pdf	465.0	647419.0
IJHS-42-2007-Issue-3	Towards the Wootz: Iron and Steel Technology in India 	 Vibha Tripathi	https://insa.nic.in//writereaddata/UpLoadedFiles/IJHS/Vol42_3_6_VTripathi.pdf	298.0	647717.0
IJHS-42-2007-Issue-3	New Insights on Classification of Iron-Carbon Alloys‚ Specially High Carbon Steels‚ in Rasaratnasamuccaya 	 R Balasubramaniam and S Kalyanaraman	https://insa.nic.in//writereaddata/UpLoadedFiles/IJHS/Vol42_3_7_RBalasubramaniam.pdf	256.0	647973.0
IJHS-42-2007-Issue-3	Survey of Iron and Wootz Steel Production Sites in Northern Telangana 	 S Jaikishan	https://insa.nic.in//writereaddata/UpLoadedFiles/IJHS/Vol42_3_8_SJaikishan.pdf	414.0	648387.0
IJHS-42-2007-Issue-3	Material Evidences for Wootz Steel Production in Northern Telangana 	 S Jaikishan and R Balasubramaniam	https://insa.nic.in//writereaddata/UpLoadedFiles/IJHS/Vol42_3_9_SJaikishan.pdf	579.0	648966.0
IJHS-42-2007-Issue-3	Social Aspects of  Wootz Steel Manufacture in Northern Telangana 	 S Jaikishan and R Balasubramaniam	https://insa.nic.in//writereaddata/UpLoadedFiles/IJHS/Vol42_3_10_SJaikishan.pdf	262.0	649228.0
IJHS-42-2007-Issue-3	On the Varied Applications of Wootz Steel 	 R Balasubramaniam	https://insa.nic.in//writereaddata/UpLoadedFiles/IJHS/Vol42_3_11_RBalasubramaniam.pdf	494.0	649722.0
IJHS-42-2007-Issue-3	Historical Note: Wootz Steel Received by Alexander 	 R Balasubramaniam	https://insa.nic.in//writereaddata/UpLoadedFiles/IJHS/Vol42_3_12_HistoricalNoteRBalasubramaniam.pdf	126.0	649848.0
IJHS-42-2007-Issue-3	Historical Note: Crucibal Steel in Sri Lanka in the First Millennium AD and the Early Twentieth Century 	 Gill Juleff	https://insa.nic.in//writereaddata/UpLoadedFiles/IJHS/Vol42_3_13_HistoricalNoteGJuleff.pdf	24.0	649872.0
IJHS-42-2007-Issue-3	Historical Note: Swords of Sirohi 	 Lalit Pandey	https://insa.nic.in//writereaddata/UpLoadedFiles/IJHS/Vol42_3_14_HistoricalNoteLPandey.pdf	31.0	649903.0
IJHS-42-2007-Issue-3	Historical Note: Recreating Wootz Steel Outside India 	 R Balasubramaniam	https://insa.nic.in//writereaddata/UpLoadedFiles/IJHS/Vol42_3_15_Historical NoteRBalasubramaniam.pdf	96.0	649999.0
IJHS-42-2007-Issue-4	Damascus Steels: History‚ Processing‚ Properties and Carbon Dating 	 J Wadsworth	https://insa.nic.in//writereaddata/UpLoadedFiles/IJHS/Vol42_4_1_JWadsworth.pdf	454.0	650453.0
IJHS-42-2007-Issue-4	Pattern Formation in Wootz Damascus Steel Swords and Blades 	 John Verhoeven	https://insa.nic.in//writereaddata/UpLoadedFiles/IJHS/Vol42_4_2_JVerhoeven.pdf	358.0	650811.0
IJHS-42-2007-Issue-4	Wootz Decarburisation during the forging of a Sword 	 Jean Le Coze and Asdin Aoufi	https://insa.nic.in//writereaddata/UpLoadedFiles/IJHS/Vol42_4_3_JLCoze.pdf	218.0	651029.0
IJHS-42-2007-Issue-4	Cast Iron: The Elusive Feedstock of Crucible Steel 	 Paul T Craddock	https://insa.nic.in//writereaddata/UpLoadedFiles/IJHS/Vol42_4_4_PTCraddock.pdf	188.0	651217.0
IJHS-42-2007-Issue-4	Microstructural Characterization along the length of a Wedge Shaped Wootz Steel Implement 	 Vinod Kumar‚ M R Barnett‚ R Balasubramaniam and S Jaikishan	https://insa.nic.in//writereaddata/UpLoadedFiles/IJHS/Vol42_4_5_VKumar.pdf	548.0	651765.0
IJHS-42-2007-Issue-4	New Insights on the Mechanism of Carbide Banding in Thermomechanically Processed Wootz Steel Obtained Using Electron Back Scattering Diffraction 	 M R Barnett and R Balasubramaniam	https://insa.nic.in//writereaddata/UpLoadedFiles/IJHS/Vol42_4_6_MRBarnett.pdf	392.0	652157.0
IJHS-42-2007-Issue-4	Analysis of Wootz Steel Crucibles from Northern Telangana 	 R Balasubramaniam‚ Anubhav Pandey and S Jaikishan	https://insa.nic.in//writereaddata/UpLoadedFiles/IJHS/Vol42_4_7_RBalasubramaniam.pdf	444.0	652601.0
IJHS-42-2007-Issue-4	On Higher Carbon and Crucible Steels in Southern India: Further Insights from Mel-Siruvalur‚ Kodumanal and Pattinam 	 Sharada Srinivasan	https://insa.nic.in//writereaddata/UpLoadedFiles/IJHS/Vol42_4_8_SSrinivasan.pdf	401.0	653002.0
IJHS-42-2007-Issue-4	Historical Note: Konasamudram: The Famous Wootz Steel Production Center 	 S Jaikishan and R Balasubramaniam	https://insa.nic.in//writereaddata/UpLoadedFiles/IJHS/Vol42_4_9_HistoricalNotes.pdf	74.0	653076.0
IJHS-42-2007-Issue-4	Historical Note: Interview with Wootz Steel Worker from Konapuram Village in Northern Telangana 	 S Jaikishan and R Balasubramaniam	https://insa.nic.in//writereaddata/UpLoadedFiles/IJHS/Vol42_4_10_SJaikishan.pdf	68.0	653144.0
IJHS-42-2007-Issue-4	Book Review: Persian Steel: The Tanavoli Collection 	 R Balasubramaniam	https://insa.nic.in//writereaddata/UpLoadedFiles/IJHS/Vol42_4_11_BookReview.pdf	137.0	653281.0
IJHS-42-2007-Issue-4	Supplement: Khadgalaksana Siromani of Navanappa 	 S Jaikishan	https://insa.nic.in//writereaddata/UpLoadedFiles/IJHS/Vol42_4_12_Supplement.pdf	552.0	653833.0
IJHS-43-2008-Issue-1	Archaic Astronomy of Parauara and Vrddha Garga 	 R N Iyengar	https://insa.nic.in//writereaddata/UpLoadedFiles/IJHS/Vol43_1_1_RNIyengar.pdf	220.0	654053.0
IJHS-43-2008-Issue-1	Recent Bronze Hoard from West Bengal: Analytical Studies 	 Sumita Santra‚ Gautam Sengupta‚ Dipan Bhattacharya‚ Manoranjan Sarkar‚ Prati	https://insa.nic.in//writereaddata/UpLoadedFiles/IJHS/Vol43_1_2_SSantra.pdf	208.0	654261.0
IJHS-43-2008-Issue-1	Water Resources in the Hill Forts of South India (14—18th Century) 	 Jean Deloche	https://insa.nic.in//writereaddata/UpLoadedFiles/IJHS/Vol43_1_3_JDeloche.pdf	344.0	654605.0
IJHS-43-2008-Issue-1	Two Recently Discovered Patents of Professor Jagadis Chunder Bose and India’s First Electronics Technology Transfer to the West 	 Probir K Bondyopadhyay and Suchanda Banerjee	https://insa.nic.in//writereaddata/UpLoadedFiles/IJHS/Vol43_1_4_PKBondyopadhyay.pdf	435.0	655040.0
IJHS-43-2008-Issue-1	Historical Note: On the Precessional Movement of Saptarsis 	 K D Abhyankar	https://insa.nic.in//writereaddata/UpLoadedFiles/IJHS/Vol43_1_5_KDAbhyankar.pdf	148.0	655188.0
IJHS-43-2008-Issue-1	Historical Note: True Laksa—Scale Numeration System of the Valmiki—Ramayana 	 R C Gupta	https://insa.nic.in//writereaddata/UpLoadedFiles/IJHS/Vol43_1_6_RCGupta.pdf	99.0	655287.0
IJHS-43-2008-Issue-1	Historical Note: Astro—Navigational Aspects of the Bhumi Anla 	 Deepak Bhattacharya and PC Naik	https://insa.nic.in//writereaddata/UpLoadedFiles/IJHS/Vol43_1_7_DBhattacharya.pdf	195.0	655482.0
IJHS-43-2008-Issue-1	Historical Note: Srstikrama Construction of Sriyantra 	 D N Ukidwe	https://insa.nic.in//writereaddata/UpLoadedFiles/IJHS/Vol43_1_8_DNUkidwe.pdf	158.0	655640.0
IJHS-43-2008-Issue-1	Historical Note: Select Palm Leaf Manuscripts in Orissa State Museum‚ Bhubaneswar on Astronomy and Mathematics 	 Deepak Bhattacharya	https://insa.nic.in//writereaddata/UpLoadedFiles/IJHS/Vol43_1_9_DBhattacharya.pdf	102.0	655742.0
IJHS-43-2008-Issue-1	Historical Note: The Gifts of Chemistry to Modern Medicine 	 Sisir Kumar Majumdar	https://insa.nic.in//writereaddata/UpLoadedFiles/IJHS/Vol43_1_10_SKMajumdar.pdf	100.0	655842.0
IJHS-43-2008-Issue-1	Book Review: Social History of Science in Colonial India 	 Chittabrata Palit	https://insa.nic.in//writereaddata/UpLoadedFiles/IJHS/Vol43_1_11_BookReview_CPalit.pdf	78.0	655920.0
IJHS-43-2008-Issue-1	Book Review: The Bengal Renaissance 	 A K Biswas	https://insa.nic.in//writereaddata/UpLoadedFiles/IJHS/Vol43_1_12_BookReview_AKBiswas.pdf	113.0	656033.0
IJHS-43-2008-Issue-1	Obituary: KD Abhyankar (1928—2007) 	 	https://insa.nic.in//writereaddata/UpLoadedFiles/IJHS/Vol43_1_13_Obituary.pdf	84.0	656117.0
IJHS-43-2008-Issue-1	News 	 Shabnam Shukla	https://insa.nic.in//writereaddata/UpLoadedFiles/IJHS/Vol43_1_14_News.pdf	73.0	656190.0
IJHS-43-2008-Issue-1	Supplement: Karanakutuhalam of Bhaskaracarya II 	 S Balachandra Rao	https://insa.nic.in//writereaddata/UpLoadedFiles/IJHS/Vol43_1_15_Supplement.pdf	291.0	656481.0
IJHS-43-2008-Issue-2	Glimpses of Ayurveda in Medieval Chinese Medicine 	 Vijaya Jayant Deshpande	https://insa.nic.in//writereaddata/UpLoadedFiles/IJHS/Vol43_2_1_VJDeshpande.pdf	303.0	656784.0
IJHS-43-2008-Issue-2	Encounter In Anatomical Knowledge: East And West 	 Jayanta Bhattacharya	https://insa.nic.in//writereaddata/UpLoadedFiles/IJHS/Vol43_2_2_JBhattacharya.pdf	252.0	657036.0
IJHS-43-2008-Issue-2	Environment and Cholera in Kashmir during Nineteenth Century 	 Rais Akhtar	https://insa.nic.in//writereaddata/UpLoadedFiles/IJHS/Vol43_2_3_RAkhtar.pdf	196.0	657232.0
IJHS-43-2008-Issue-2	Ram Nath Chopra (1882—1973) — A Vissionary in Pharmaceutical Science 	 Harkishan Singh	https://insa.nic.in//writereaddata/UpLoadedFiles/IJHS/Vol43_2_4_HSingh.pdf	224.0	657456.0
IJHS-43-2008-Issue-2	Historical Note: Ancient Methods of Preserving Copper Plate Grants 	 Subrata Kumar Acharya	https://insa.nic.in//writereaddata/UpLoadedFiles/IJHS/Vol43_2_5_SKAcharya.pdf	126.0	657582.0
IJHS-43-2008-Issue-2	Historical Note: Popular Response to Epidemics in Colonial Bengal 	 Chittabrata Palit	https://insa.nic.in//writereaddata/UpLoadedFiles/IJHS/Vol43_2_6_CPalit.pdf	90.0	657672.0
IJHS-43-2008-Issue-2	Historical Note: Superiority of Makrana (Rajasthan) Marbles 	 R K Dube	https://insa.nic.in//writereaddata/UpLoadedFiles/IJHS/Vol43_2_7_RKDube.pdf	94.0	657766.0
IJHS-43-2008-Issue-2	Historical Note: Socio—Political Thoughts of Einstein 	 Sisir K Majumdar	https://insa.nic.in//writereaddata/UpLoadedFiles/IJHS/Vol43_2_8_SKMjumdar.pdf	123.0	657889.0
IJHS-43-2008-Issue-2	Book Review: Story of the Delhi Iron Pillar 	 Arun Kumar Biswas	https://insa.nic.in//writereaddata/UpLoadedFiles/IJHS/Vol43_2_9_BookReview.pdf	99.0	657988.0
IJHS-43-2008-Issue-2	Obituary: Priyavrata Sharma — A Legendary Personality (1920—2007) 	 P V Tiwari	https://insa.nic.in//writereaddata/UpLoadedFiles/IJHS/Vol43_2_10_Obituary.pdf	250.0	658238.0
IJHS-43-2008-Issue-3	Vedanga Jyotisa — Where and When? 	 Prabhakar Gondhalekar	https://insa.nic.in//writereaddata/UpLoadedFiles/IJHS/Vol43_3_1_PGondhalekar.pdf	217.0	658455.0
IJHS-43-2008-Issue-3	The Jewish calendar and its relation to the Christian holidays as described by a Muslim Mathematician—Astronomer in 852 AD 	 Ariel Cohen	https://insa.nic.in//writereaddata/UpLoadedFiles/IJHS/Vol43_3_2_ACohen.pdf	219.0	658674.0
IJHS-43-2008-Issue-3	Investigations on Ancient High — Tin Bronze Excavated From Lower Bengal Region of Tilpi 	 Prasanta K Datta‚ Pranab K Chattopadhyay and Barnali Mandal	https://insa.nic.in//writereaddata/UpLoadedFiles/IJHS/Vol43_3_3_PKDatta.pdf	431.0	659105.0
IJHS-43-2008-Issue-3	Historical Note: Archaeo—Astronomy of Nataraja 	 Deepak Bhattacharya	https://insa.nic.in//writereaddata/UpLoadedFiles/IJHS/Vol43_3_4_DBhattacharya.pdf	282.0	659387.0
IJHS-43-2008-Issue-3	Historical Note: Karka—Rasi—Valaya—The Instrument on the Back Wall of the Misra Yantra 	 N Rathnasree‚ Anurag Garg‚ Arpita Pandey and R K Chikara	https://insa.nic.in//writereaddata/UpLoadedFiles/IJHS/Vol43_3_5_NRatnasree.pdf	180.0	659567.0
IJHS-43-2008-Issue-3	Historical Note: Indo—American Relation with reference to Bernard Peters 	 Rajinder Singh	https://insa.nic.in//writereaddata/UpLoadedFiles/IJHS/Vol43_3_6_RSingh.pdf	145.0	659712.0
IJHS-43-2008-Issue-3	Book Review: Studies in the History of the Exact Sciences in Honour of David Pingree 	 S Balachandra Rao	https://insa.nic.in//writereaddata/UpLoadedFiles/IJHS/Vol43_3_7_BookReview.pdf	168.0	659880.0
IJHS-43-2008-Issue-3	Obituary: Kripa Shankar Shukla (1918—2007) 	 Yukio Ohashi	https://insa.nic.in//writereaddata/UpLoadedFiles/IJHS/Vol43_3_8_Obituary.pdf	122.0	660002.0
IJHS-43-2008-Issue-3	News: National Workshop on Preserving our Scientific Heritage‚ held at Indian Institute of Astrophysics‚ Bangalore‚ January 21—22‚ 2008 — A Report 	 A Vagiswari‚ Christina Birdie and Indira Chowdhury	https://insa.nic.in//writereaddata/UpLoadedFiles/IJHS/Vol43_3_9_News.pdf	94.0	660096.0
IJHS-43-2008-Issue-3	Supplement: Karanakutuhalam of Bhaskaracarya II 	 S Balachandra Rao	https://insa.nic.in//writereaddata/UpLoadedFiles/IJHS/Vol43_3_10_Supplement.pdf	454.0	660550.0
IJHS-43-2008-Issue-4	Intercalation in the Vedic Texts 	 Prabhakar Gondhalekar	https://insa.nic.in//writereaddata/UpLoadedFiles/IJHS/Vol43_4_1_PGondhalekar.pdf	282.0	660832.0
IJHS-43-2008-Issue-4	Conjunctions‚ Transits and Occultations by Siddhantic Procedures 	 S Balachandra Rao‚ S K Uma and Padmaja Venugopal	https://insa.nic.in//writereaddata/UpLoadedFiles/IJHS/Vol43_4_2_Sbalachandrarao.pdf	372.0	661204.0
IJHS-43-2008-Issue-4	Interpolation of Sines by Successive Approximation Method 	 V Madhukar Mallayya	https://insa.nic.in//writereaddata/UpLoadedFiles/IJHS/Vol43_4_3_VMMallayya.pdf	149.0	661353.0
IJHS-43-2008-Issue-4	Scientific Research Papers in the Philosophical Transactions of the Royal Society of London‚ 1665—1800: The Development of Physics in the footsteps of Sir Isaac Newton 	 S Ducheyne	https://insa.nic.in//writereaddata/UpLoadedFiles/IJHS/Vol43_4_4_SDucheyne.pdf	681.0	662034.0
IJHS-43-2008-Issue-4	Historical Note: Khem Singh Grewal (1894—4965) — A Prominent Medico—Pharmaceutical Professional 	 Harkishan Singh	https://insa.nic.in//writereaddata/UpLoadedFiles/IJHS/Vol43_4_5_HSingh.pdf	187.0	662221.0
IJHS-43-2008-Issue-4	Historical Note: Robotics (Cybernetics) in Medical Science: Blessing or Blight 	 Sisir K Majumdar	https://insa.nic.in//writereaddata/UpLoadedFiles/IJHS/Vol43_4_6_SKMajumdar.pdf	55.0	662276.0
IJHS-43-2008-Issue-4	Book Review: History of Iron Technology in India 	 K Rajan	https://insa.nic.in//writereaddata/UpLoadedFiles/IJHS/Vol43_4_7_BookReviewKRajan.pdf	47.0	662323.0
IJHS-43-2008-Issue-4	Book Review: Marvels of Indian Iron through the Ages 	 B Prakash	https://insa.nic.in//writereaddata/UpLoadedFiles/IJHS/Vol43_4_8_BookReviewBPrakash.pdf	83.0	662406.0
IJHS-43-2008-Issue-4	News 	 	https://insa.nic.in//writereaddata/UpLoadedFiles/IJHS/Vol43_4_9_News.pdf	18.0	662424.0
IJHS-43-2008-Issue-4	Books received for Review 	 	https://insa.nic.in//writereaddata/UpLoadedFiles/IJHS/Vol43_4_10_BooksreceivedforReview.pdf	24.0	662448.0
IJHS-44-2009-Issue-1	Editorial 	 	https://insa.nic.in//writereaddata/UpLoadedFiles/IJHS/Vol44_1_0_Editorial.pdf	318.0	662766.0
IJHS-44-2009-Issue-1	Ecological concept in Ayurveda: Nature-man relations 	 Mira Roy	https://insa.nic.in//writereaddata/UpLoadedFiles/IJHS/Vol44_1_1_MRoy.pdf	71.0	662837.0
IJHS-44-2009-Issue-1	Biodiversity: Methods of Conservation in the Usanah Samita 	 Priyadarsan Sensarma	https://insa.nic.in//writereaddata/UpLoadedFiles/IJHS/Vol44_1_2_PSensarma.pdf	35.0	662872.0
IJHS-44-2009-Issue-1	On technical analysis of Cannon Shot Crater on Delhi Iron Pillar 	 R Balasubramaniama, V N Prabhakarb and Manish Shankara	https://insa.nic.in//writereaddata/UpLoadedFiles/IJHS/Vol44_1_3_RBalasubramaniam.pdf	342.0	663214.0
IJHS-44-2009-Issue-1	Religious traditions of Ancient Iron and Steel Craftsmen of India and Japan 	 B. Prakash	https://insa.nic.in//writereaddata/UpLoadedFiles/IJHS/Vol44_1_4_BPrakash.pdf	459.0	663673.0
IJHS-44-2009-Issue-1	Science of Siege Warfare in India during the Great Mutiny: 1857-58 	 Kaushik Roy	https://insa.nic.in//writereaddata/UpLoadedFiles/IJHS/Vol44_1_5_KRoy.pdf	61.0	663734.0
IJHS-44-2009-Issue-1	Historical Notes: On the Sanskrit word, Svarnaja used for metal, tin 	 R.K. Dube	https://insa.nic.in//writereaddata/UpLoadedFiles/IJHS/Vol44_1_6_Historical Notes.pdf	63.0	663797.0
IJHS-44-2009-Issue-1	Historical Notes: Identification of Asmaka 	 K Chandra Hari	https://insa.nic.in//writereaddata/UpLoadedFiles/IJHS/Vol44_1_7_KCHari.pdf	62.0	663859.0
IJHS-44-2009-Issue-1	Historical Notes: The Genius of Darwin- Two Hundred Years 	 Sisir K. Majumdar	https://insa.nic.in//writereaddata/UpLoadedFiles/IJHS/Vol44_1_8_SKMajumdar.pdf	40.0	663899.0
IJHS-44-2009-Issue-1	Book Review 	 M.S. Sriram	https://insa.nic.in//writereaddata/UpLoadedFiles/IJHS/Vol44_1_9_Book Review.pdf	43.0	663942.0
IJHS-44-2009-Issue-2	Editorial 	 	https://insa.nic.in//writereaddata/UpLoadedFiles/IJHS/Vol44_2_0_Editorial.pdf	144.0	664086.0
IJHS-44-2009-Issue-2	Transmitting the Carakasamhita: A History of the Tradition 	 Cristina Pecchia	https://insa.nic.in//writereaddata/UpLoadedFiles/IJHS/Vol44_2_1_CPechhia.pdf	66.0	664152.0
IJHS-44-2009-Issue-2	Towards a critical edition of the Carakasamhita Vimanasthana - First results 	 Philipp A Maas	https://insa.nic.in//writereaddata/UpLoadedFiles/IJHS/Vol44_2_2_PAMaas.pdf	636.0	664788.0
IJHS-44-2009-Issue-2	New Evidence for the Textual and Cultural History of the Susruta Samhita 	 Dominik Wujastyk	https://insa.nic.in//writereaddata/UpLoadedFiles/IJHS/Vol44_2_3_DWujastyk.pdf	2110.0	666898.0
IJHS-44-2009-Issue-2	Some reflections on Siddha medicine in Tamilnadu 	 Kenneth G Zysk	https://insa.nic.in//writereaddata/UpLoadedFiles/IJHS/Vol44_2_4_KGZysk.pdf	37.0	666935.0
IJHS-44-2009-Issue-2	Metals, minerals and medicine 	 Paul T Craddock	https://insa.nic.in//writereaddata/UpLoadedFiles/IJHS/Vol44_2_5_PT Craddock.pdf	512.0	667447.0
IJHS-44-2009-Issue-2	Narrative well-being: Anandarayamakhin's the Joy of Life (Jivanandanam) 	 Anthony Cerulli	https://insa.nic.in//writereaddata/UpLoadedFiles/IJHS/Vol44_2_6_ACerulli.pdf	65.0	667512.0
IJHS-44-2009-Issue-2	An analysis of formulation of Vaitarana  [Basti] on the basis of Ayurvedic texts and Commentaries 	 Manoj Sankaranarayana	https://insa.nic.in//writereaddata/UpLoadedFiles/IJHS/Vol44_2_7_MSankaranarayana.pdf	85.0	667597.0
IJHS-44-2009-Issue-2	Logic, Debate and Epistemology in Ancient Indian medicine and Philosophy - An Investigation 	 Karin Preisendanz	https://insa.nic.in//writereaddata/UpLoadedFiles/IJHS/Vol44_2_8_KPrasendanz.pdf	221.0	667818.0
IJHS-44-2009-Issue-2	Historical Note: Depiction of Human Anatomy in Indian Archaeology- A select report 	 Deepak Bhattacharya	https://insa.nic.in//writereaddata/UpLoadedFiles/IJHS/Vol44_2_9_HistoricalNotes.pdf	323.0	668141.0
IJHS-44-2009-Issue-2	Historical Note: Eye Diseases in traditional Siddha System of Medicine - An Overview 	 S. Prema	https://insa.nic.in//writereaddata/UpLoadedFiles/IJHS/Vol44_2_10_SPrema.pdf	159.0	668300.0
IJHS-44-2009-Issue-2	Historical Note:  Ayurvedic Concept of Cancer and its treatment 	 Roma Sarkar	https://insa.nic.in//writereaddata/UpLoadedFiles/IJHS/Vol44_2_11_RSarkar.pdf	42.0	668342.0
IJHS-44-2009-Issue-2	Historical Note: Dr. Subodh Mitra (1896-1961) - A Visionary of Cancer Treatment and Research in India 	 Sukta Das	https://insa.nic.in//writereaddata/UpLoadedFiles/IJHS/Vol44_2_12_SDas.pdf	158.0	668500.0
IJHS-44-2009-Issue-2	Supplement: Rasaprakasa Sudhakara 	 	https://insa.nic.in//writereaddata/UpLoadedFiles/IJHS/Vol44_2_13_Supplement.pdf	145.0	668645.0
IJHS-44-2009-Issue-3	Connections Between The Vedanga Jyotisa And Other Vedic Literature 	 R N Iyengar	https://insa.nic.in//writereaddata/UpLoadedFiles/IJHS/Vol44_3_1_RNIyengar.pdf	46.0	668691.0
IJHS-44-2009-Issue-3	Bintie— The Wootz Steel In Ancient China 	 William Lox	https://insa.nic.in//writereaddata/UpLoadedFiles/IJHS/Vol44_3_2_WLox.pdf	234.0	668925.0
IJHS-44-2009-Issue-3	New Insights On Architects Of Taj 	 R Balasubramaniam	https://insa.nic.in//writereaddata/UpLoadedFiles/IJHS/Vol44_3_3_RBalasubramaniampdf.pdf	162.0	669087.0
IJHS-44-2009-Issue-3	Technology Transfer And The Evolution Of Ordnance Establishment In British—India— 1639 to 1856 	 Kaushik Roy	https://insa.nic.in//writereaddata/UpLoadedFiles/IJHS/Vol44_3_4_KRoy.pdf	66.0	669153.0
IJHS-44-2009-Issue-3	Historical Notes 	 Sisir K Majumdar	https://insa.nic.in//writereaddata/UpLoadedFiles/IJHS/Vol44_3_5_Historical Notes.pdf	87.0	669240.0
IJHS-44-2009-Issue-3	The Circular Drona— KuRma and Sarathacakra Citis in the Sulbasu— Tras 	 R Bhattacharya	https://insa.nic.in//writereaddata/UpLoadedFiles/IJHS/Vol44_3_6_RBhattacharya.pdf	114.0	669354.0
IJHS-44-2009-Issue-3	History Of Science Program Of The Indian National Science Academy (1959— 2009) 	 A K Bag	https://insa.nic.in//writereaddata/UpLoadedFiles/IJHS/Vol44_3_7_AKBag.pdf	35.0	669389.0
IJHS-44-2009-Issue-3	Book Review 	 A K Biswas	https://insa.nic.in//writereaddata/UpLoadedFiles/IJHS/Vol44_3_8_AKBiswaspdf.pdf	24.0	669413.0
IJHS-44-2009-Issue-3	Conference on Indian Astronomy and Mathematics In Ancient India— A Report 	 J M Delire	https://insa.nic.in//writereaddata/UpLoadedFiles/IJHS/Vol44_3_9_News.pdf	23.0	669436.0
IJHS-44-2009-Issue-3	History Of Science Project Investigator’s Meet Cum Workshop On 13-15th April 2009 : A Report 	 Shabnam Shukla	https://insa.nic.in//writereaddata/UpLoadedFiles/IJHS/Vol44_3_10_SShuklapdf.pdf	18.0	669454.0
IJHS-44-2009-Issue-3	Rasaprakasa Sudhakarachap— Ch2 Supplement 	 Damodar Joshi	https://insa.nic.in//writereaddata/UpLoadedFiles/IJHS/Vol44_11_SupplementRasaprakasasudhakara.pdf	46.0	669500.0
IJHS-44-2009-Issue-4	The Vedic Naksatras— A Reappraisal 	 Prabhakar Gondhalekar	https://insa.nic.in//writereaddata/UpLoadedFiles/IJHS/Vol44_4_1_PGondhalekar.pdf	112.0	669612.0
IJHS-44-2009-Issue-4	Agriculture In The Vedic Period 	 Mira Roy	https://insa.nic.in//writereaddata/UpLoadedFiles/IJHS/Vol44_4_2_MRoy.pdf	82.0	669694.0
IJHS-44-2009-Issue-4	New Insights On Artisans Of Taj 	 R Balasubramaniam	https://insa.nic.in//writereaddata/UpLoadedFiles/IJHS/Vol44_4_3_RBalasubramaniam.pdf	330.0	670024.0
IJHS-44-2009-Issue-4	Stableships Of Tiruppudaimarudur And Tirukkurunkudi (South India) 	 Jean Deloche	https://insa.nic.in//writereaddata/UpLoadedFiles/IJHS/Vol44_4_4_JDeloche.pdf	797.0	670821.0
IJHS-44-2009-Issue-4	Bishnupada Mukerji (1903—79): A Medicopharmaceutical Professional Of Eminence 	 Harkishan Singh	https://insa.nic.in//writereaddata/UpLoadedFiles/IJHS/Vol44_4_5_HSingh.pdf	118.0	670939.0
IJHS-44-2009-Issue-4	Historical Notes:Spice And Herb— A Historical Overview 	 Sisir K Majumdar	https://insa.nic.in//writereaddata/UpLoadedFiles/IJHS/Vol44_4_6_Historical Notes.pdf	20.0	670959.0
IJHS-44-2009-Issue-4	Book Review 	 A K Bag	https://insa.nic.in//writereaddata/UpLoadedFiles/IJHS/Vol44_4_7_AKBag.pdf	34.0	670993.0
IJHS-44-2009-Issue-4	Seminar Report CNRS—NYU Workshop On Early Mathematics: A Report 	 Toke L Knudsen	https://insa.nic.in//writereaddata/UpLoadedFiles/IJHS/Vol44_4_8_SeminarReport.pdf	13.0	671006.0
IJHS-44-2009-Issue-4	The 69th Session Of The Indian History Congress :Kannur 28-30 December 2008— A Report 	 Shabnam Shukla	https://insa.nic.in//writereaddata/UpLoadedFiles/IJHS/Vol44_4_9_SShukla.pdf	17.0	671023.0
